{
  "$schema": "https://json-schema.org/draft/2020-12/schema",
  "$id": "https://openbindings.com/interfaces/conformance/selection/fixture.schema.json",
  "title": "Operation-Invoker Binding-Selection Conformance Fixture",
  "description": "JSON Schema describing the format of a binding-selection conformance fixture file (one rule-cluster of the operation-invoker contract's selection prose per file).",
  "type": "object",
  "required": ["cluster", "description", "tests"],
  "additionalProperties": false,
  "properties": {
    "cluster": {
      "type": "string",
      "pattern": "^[a-z0-9]+(-[a-z0-9]+)*$",
      "description": "Slug naming the rule-cluster of the binding-resolution contract this file covers (e.g., 'automatic-resolution', 'override-selection'). Matches the file's basename."
    },
    "description": {
      "type": "string",
      "minLength": 1,
      "description": "Human-readable statement of the rule-cluster, ideally byte-faithful to the operation-invoker contract's prose."
    },
    "notes": {
      "type": "string",
      "description": "Optional file-level rationale about the cluster's coverage in this corpus. Informational; not consumed by harnesses."
    },
    "tests": {
      "type": "array",
      "minItems": 1,
      "description": "Test cases for this rule-cluster. Each case bundles an OBI document, an invocation addressing (operation, or operation plus explicit binding), the notional invoker's supported kind set, and the expected selection outcome.",
      "items": {
        "type": "object",
        "required": ["description", "document", "operation", "supported", "expected"],
        "not": { "required": ["binding", "selection"] },
        "additionalProperties": false,
        "properties": {
          "description": {
            "type": "string",
            "minLength": 1,
            "description": "What this specific case exercises."
          },
          "document": {
            "type": "object",
            "required": ["openbindings", "operations"],
            "description": "A complete, valid OpenBindings interface document, embedded inline. Harnesses MUST run it through their implementation's real document validation before selecting; a fixture whose document does not validate is a corpus defect."
          },
          "operation": {
            "type": "string",
            "minLength": 1,
            "description": "The operation identifier the invocation addresses (a key or alias; core §5.1 defines which operation it identifies). When 'binding' is also present, this is the operation the binding derives to: the wire contract's OperationInvocationInput carries operation and binding mutually exclusively (the operation is derived from an explicit binding), and the fixture carries the derived operation so operation-keyed native APIs can drive the same scenario. Fixture invariant: document.bindings[binding].operation resolves to this operation (vacuous when the binding key is undefined)."
          },
          "supported": {
            "type": "array",
            "items": { "type": "string", "minLength": 1 },
            "uniqueItems": true,
            "description": "The notional invoker's supported set: the exact kinds it can act on (natively or via a delegate). The candidate set is the operation's bindings whose kind appears here, by exact identifier."
          },
          "selection": {
            "type": "array",
            "items": { "type": "string", "minLength": 1 },
            "minItems": 1,
            "description": "The invocation input's ordered selection: binding keys in the caller's preference order, the first invocable entry winning. Every key must name a binding of the operation; a key that does not, or a list with no invocable entry, is ERR_BINDING_NOT_FOUND, never a fallback. Absent means no ordered choice. Never present together with binding."
          },
          "binding": {
            "type": "string",
            "minLength": 1,
            "description": "Explicit binding key: the wire contract's binding-addressed form. Other resolution is bypassed; the named binding is used even if deprecated, and an unknown key is an error. Never present together with selection."
          },
          "expected": {
            "description": "The selection outcome: either the key of the selected binding, or an error.",
            "oneOf": [
              {
                "type": "object",
                "required": ["binding"],
                "additionalProperties": false,
                "properties": {
                  "binding": {
                    "type": "string",
                    "minLength": 1,
                    "description": "The binding key selection resolves to."
                  }
                }
              },
              {
                "type": "object",
                "required": ["error"],
                "additionalProperties": false,
                "properties": {
                  "error": {
                    "const": true,
                    "description": "Binding resolution fails. Unknown named bindings and empty candidate sets use ERR_BINDING_NOT_FOUND; ambiguity uses ERR_BINDING_SELECTION_REQUIRED."
                  },
                  "kind": {
                    "enum": ["unknown-binding", "no-candidate", "ambiguous"],
                    "description": "Which rule failed: 'unknown-binding' (an explicit or listed key that names no binding of the operation), 'no-candidate' (no invocable binding among those allowed), or 'ambiguous' (several invocable bindings and no caller choice)."
                  }
                }
              }
            ]
          }
        }
      }
    }
  }
}
